SBI,SBI Card PRIME,Retail,Shopping,"Welcome e-gift Voucher worth Rs. 3,000 from various brands and 10 Reward Points per Rs. 100 spent on Dining, Groceries, Departmental stores and Movies.",https://www.sbicard.com/sbi-card-en/assets/media/images/personal/credit-cards/network-card-images/Prime_349x218-px-Front.png,https://www.sbicard.com/en/personal/credit-cards/rewards/sbi-card-prime.page,https://www.bankbazaar.com/credit-card.html?variant=slide,"Rs. 2,999 + Taxes","Rs. 2,999 + Taxes",Waiver of Renewal Fee on annual spends of Rs. 3 Lakhs,Nil,45% per annum,NILL,₹250,NILL,NILL,NILL,2.5% of the amount withdrawn or ₹500 (Domestic ATMs),"From ₹0 to ₹500 - Nil, More than ₹500 up to ₹1,000 - ₹400, More than ₹1,000 up to ₹10,000 - ₹750, More than ₹10,000 up to ₹25,000 - ₹950, More than ₹25,000 up to ₹50,000 - ₹1,100, More than ₹50,000 - ₹1,300",2.5% of the over limit amount; minimum of ₹600,3.50%,₹99,NILL,NILL,NILL,NILL,NILL,"Get 10 Reward Points per Rs. 100 spent on Dining, Groceries, Departmental stores and Movies; 2 Reward Points per Rs. 100 on all other retail spends except fuel.",1% Fuel Surcharge Waiver on transaction amount ranging from Rs. 500- Rs. 4000 across all petrol pumps.,Annual fee reversed if spends > Rs. 1 lakh/year,"Yes, on spends above Rs. 2,500",True,"Pizza Hut e-Voucher worth Rs. 1,000 on achieving spends of Rs. 50,000 in a calendar quarter; E-Gift Voucher worth Rs. 7,000 from Yatra.com/Pantaloons on achieving annual spends of Rs. 5 Lakhs.","4 complimentary visits per calendar year to International Priority Pass Lounges, 8 complimentary visits per calendar year to Domestic Lounges in India, 20 Reward Points per Rs. 100 spent on your birthday.",NILL,False,False,False,False,1% Fuel Surcharge Waiver on transaction amount ranging from Rs. 500-Rs.4000 across all petrol pumps.,20% off at select restaurants.,NILL,"Free travel insurance, airport transfers.",Buy 1 Get 1 free ticket monthly.,3 months free Netflix.,NILL,"₹500 Myntra voucher on spends > ₹50,000.",Extra points on app transactions.,10% off at partner hotels.,Free gym membership.,2% cashback on Amazon/Flipkart.,True,24x7 concierge for travel bookings.,False,Zero liability if reported within 24 hours.,NILL,"Chip and PIN, contactless.",True,"This card offers premium travel, shopping, and lifestyle benefits, including lounge access, high rewards, and robust insurance, making it ideal for frequent travelers.",You must be between 18 - 80 years of age. Add-on credit cardholder must be above 18 years.,All dues must be paid on time; rewards program subject to change.,"4 complimentary visits per calendar year to International Priority Pass Lounges, 8 complimentary visits per calendar year to Domestic Lounges in India, 20 Reward Points per Rs. 100 spent on your birthday.",False,False,False,False,"Pizza Hut e-Voucher worth Rs. 1,000 on achieving spends of Rs. 50,000 in a calendar quarter; E-Gift Voucher worth Rs. 7,000 from Yatra.com/Pantaloons on achieving annual spends of Rs. 5 Lakhs.",True,False,True,False,False,False
SBI,SBI Card ELITE,Lifestyle,Travel & Lifestyle,"Complimentary airport lounge access, free movie tickets, and high rewards on dining and shopping.",https://www.sbicard.com/sbi-card-en/assets/media/images/personal/credit-cards/network-card-images/Elite_349x218-px-Front.png,https://www.sbicard.com/en/personal/credit-cards/lifestyle/sbi-card-elite.page,https://www.sbicard.com/en/eapply.page,"₹4,999 + Taxes","₹4,999 + Taxes",Annual fee waived on spends of ₹10 lakh or more in a year,Nil,3.50% per month or 42% per annum,₹100 to ₹250,₹250,₹100,NILL,NILL,2.5% of the amount withdrawn or ₹500 (Domestic ATMs),Varies based on amount due,2.5% of the over limit amount; minimum of ₹600,1.99%,NILL,NILL,NILL,NILL,"1% fuel surcharge waiver on transactions between ₹500 to ₹4,000",NILL,"5X Reward Points on Dining, Departmental stores and Grocery Spends; 2 Reward Points per ₹100 on all other spends",NILL,Annual fee reversed on spends of ₹10 lakh,"Yes, on spends above ₹2,500",False,"Free movie tickets worth ₹6,000 every year, up to 50,000 Bonus Reward Points worth ₹12,500 annually","Complimentary airport lounge access, low forex markup, concierge service, and fraud liability cover",NILL,False,False,False,True,1% fuel surcharge waiver,NILL,NILL,Complimentary international lounge access via Priority Pass,"Free movie tickets worth ₹6,000 annually",NILL,NILL,NILL,NILL,NILL,NILL,NILL,True,Dedicated assistance for various services,False,Zero liability if reported within 48 hours,NILL,"Chip and PIN enabled, contactless payments",True,"The SBI Card ELITE is a premium credit card offering extensive travel, shopping, and lifestyle benefits, including complimentary lounge access and high rewards on spending.","Minimum age of 21 years, good credit score, and sufficient income to meet the bank's requirements.",All dues must be paid on time; rewards program subject to change.,"Complimentary airport lounge access, low forex markup, concierge service, and fraud liability cover",False,False,False,False,"Free movie tickets worth ₹6,000 every year, up to 50,000 Bonus Reward Points worth ₹12,500 annually",False,False,False,False,False,True
SBI,SBI Card PULSE,Lifestyle,Lifestyle,"Get a Noise ColorFit Pulse 4 Pro Smart Watch worth Rs. 7,999 on payment of joining fee",https://www.sbicard.com/sbi-card-en/assets/media/images/personal/credit-cards/network-card-images/240759_SBI_Pulse_349-x-218px-01.png,https://www.sbicard.com/en/personal/credit-cards/lifestyle/sbi-card-pulse.page,https://www.sbicard.com/sprint/pulseMaster,"Rs. 1,499 + Taxes","Rs. 1,499 + Taxes",Waived off on annual spends of Rs. 2 Lakhs,NILL,3.5%,Rs. 100 - Rs. 250,Rs. 250,Rs. 100,NILL,NILL,2.5% or Rs. 500,NILL,2.5%,3.5%,NILL,3.5%,NILL,NILL,1%,NILL,"10 Reward Points per Rs. 100 spent on Chemist, Pharmacy, Sports, Dining and Movies spends; 2 Reward Points per Rs. 100 spent on all other spends",NILL,Annual fee reversed if spends > ₹2 lakh/year,"Yes, on spends above ₹2,500",False,"Free movie tickets, shopping vouchers, complimentary memberships","Complimentary 8 Domestic Lounge visits, Priority Pass Membership, Fraud Liability Insurance Cover, Air Accident Cover",NILL,False,False,False,False,1% fuel surcharge waiver,NILL,NILL,NILL,NILL,NILL,NILL,NILL,NILL,NILL,NILL,NILL,True,NILL,True,Zero liability if reported within 24 hours,"1 year complimentary FITPASS PRO Membership, 1 year complimentary Netmeds First Membership",NILL,False,"This card offers premium travel, shopping, and lifestyle benefits, including lounge access, high rewards, and robust insurance, making it ideal for frequent travelers.",NILL,All dues must be paid on time; rewards program subject to change.,"Complimentary 8 Domestic Lounge visits, Priority Pass Membership, Fraud Liability Insurance Cover, Air Accident Cover",False,False,False,False,"Free movie tickets, shopping vouchers, complimentary memberships",False,False,True,False,False,True
SBI,Doctor's SBI Card (in association with IMA),Retail,Lifestyle,The only credit card to be associated with the esteemed Indian Medical Association (IMA),https://www.sbicard.com/sbi-card-en/assets/media/images/personal/credit-cards/network-card-images/doctor-ima-card-face.png,https://www.sbicard.com/en/personal/credit-cards/lifestyle/doctors-ima-sbi-card.page,https://www.sbicard.com/en/eapply.page,"Rs. 1,499 + Taxes","Rs. 1,499",Renewal Fee Reversal on annual spends of Rs. 2 Lakhs,NILL,NILL,NILL,NILL,NILL,NILL,NILL,NILL,NILL,NILL,NILL,NILL,NILL,NILL,NILL,1% Fuel Surcharge Waiver at petrol pumps across the country,NILL,"Get 5X Reward Points on Medical Supplies, Travel Bookings & International Spends",NILL,Annual fee reversed if spends > Rs. 1 lakh/year,"Yes, on spends above Rs. 2,500",False,"E-Gift Voucher from Yatra.com worth Rs. 5,000 on achieving annual spends of Rs. 5 Lakhs","Complimentary membership to the Priority Pass Program worth $99, 4 complimentary visits per year to International Airport Lounges outside India",NILL,False,False,False,False,1% Fuel Surcharge Waiver at petrol pumps across the country,NILL,NILL,"Free travel insurance, airport transfers",NILL,NILL,NILL,NILL,NILL,NILL,NILL,NILL,True,24x7 concierge for travel bookings,False,Zero liability if reported within 24 hours,NILL,"Chip & PIN, contactless",True,"This card offers premium travel, shopping, and lifestyle benefits, including lounge access, high rewards, and robust insurance, making it ideal for frequent travelers.",NILL,All dues must be paid on time; rewards program subject to change.,"Complimentary membership to the Priority Pass Program worth $99, 4 complimentary visits per year to International Airport Lounges outside India",False,False,False,False,"E-Gift Voucher from Yatra.com worth Rs. 5,000 on achieving annual spends of Rs. 5 Lakhs",True,False,True,False,False,False
SBI,SBI Card ELITE Advantage,Retail,Lifestyle,"5X reward points on dining, departmental stores, and grocery spends, along with complimentary airport lounge access and free movie tickets worth up to Rs. 6,000 annually.",https://www.sbicard.com/sbi-card-en/assets/media/images/personal/credit-cards/network-card-images/Elite_349x218-px-Front.png,https://www.sbicard.com/en/personal/credit-cards/lifestyle/sbi-card-elite-advantage.page,https://www.sbicard.com/en/eapply.page,"Rs. 4,999","Rs. 4,999",Annual fee waived on spending over Rs. 10 lakh in a year,Nil,42%,Rs. 100 - Rs. 250,Rs. 250,Rs. 100,,,2.5% of the amount withdrawn or Rs. 500 (Domestic ATMs),"Rs. 750 for outstanding amount greater than Rs. 1,000 up to Rs. 10,000",2.5% of the over limit amount; minimum of Rs. 600,1.99%,Rs. 99,1.99%,,,"1% fuel surcharge waiver across all petrol pumps, capped at Rs. 250 per month",,"Earn 5X reward points on dining, departmental stores, and grocery spends; 2 reward points for every Rs. 100 spent on all other expenses, except fuel.",,Annual fee reversed if spends exceed Rs. 10 lakh/year,"Yes, on spends above Rs. 2,500",False,"Free movie tickets worth up to Rs. 6,000 annually, complimentary airport lounge access, and bonus reward points on milestone spends.","Complimentary membership to the Priority Pass Program, 6 complimentary airport lounge visits per year, and 1% fuel surcharge waiver.",,False,False,False,True,"1% fuel surcharge waiver across all petrol pumps, capped at Rs. 250 per month.",5X reward points on dining spends.,,Complimentary membership to the Priority Pass Program for international lounge access.,"Free movie tickets worth up to Rs. 6,000 annually.",,,,,,,,True,Dedicated assistance for various services including travel bookings and gift delivery.,False,Protection against unauthorized transactions with zero liability if reported within 24 hours.,,Chip and PIN enabled for enhanced security against counterfeiting and skimming.,False,"The SBI Card ELITE Advantage offers premium travel, shopping, and lifestyle benefits, including high rewards, complimentary lounge access, and robust insurance, making it ideal for frequent travelers.","Minimum age of 21 years for self-employed individuals and 18 years for salaried individuals; minimum monthly income of Rs. 60,000 required.",All dues must be paid on time; rewards program subject to change.,"Complimentary membership to the Priority Pass Program, 6 complimentary airport lounge visits per year, and 1% fuel surcharge waiver.",True,False,False,False,"Free movie tickets worth up to Rs. 6,000 annually, complimentary airport lounge access, and bonus reward points on milestone spends.",True,False,False,False,False,True
SBI Card,Doctor's SBI Card,Lifestyle,Medical,"Professional Indemnity Insurance Cover of Rs. 20 Lakhs and 5X Reward Points on Medical Supplies, Travel Bookings & International Spends",https://www.sbicard.com/sbi-card-en/assets/media/images/personal/credit-cards/network-card-images/Doctor_349x218-px-Front.png,https://www.sbicard.com/en/personal/credit-cards/lifestyle/doctors-sbi-card.page,https://www.sbicard.com/en/personal/credit-cards/lifestyle/doctors-sbi-card.page,"Rs. 1,499 + Taxes","Rs. 1,499",Renewal Fee Reversal on annual spends of Rs. 2 Lakhs,NILL,NILL,NILL,NILL,NILL,NILL,NILL,NILL,NILL,NILL,NILL,NILL,NILL,NILL,NILL,1% Fuel Surcharge Waiver at petrol pumps across the country,NILL,"Get 5X Reward Points on Medical Supplies, Travel Bookings & International Spends",NILL,Renewal Fee Reversal on annual spends of Rs. 2 Lakhs,"Yes, on spends above Rs. 2,500",False,"Free movie tickets, shopping vouchers","Professional Indemnity Insurance, 8 complimentary visits per year to Domestic Airport Lounges in India",NILL,False,False,False,False,1% Fuel Surcharge Waiver at petrol pumps across the country,NILL,NILL,Complimentary membership to the Priority Pass Program worth $99,NILL,NILL,NILL,NILL,NILL,NILL,NILL,NILL,True,NILL,True,NILL,NILL,NILL,False,"This card offers premium travel, shopping, and lifestyle benefits, including lounge access, high rewards, and robust insurance, making it ideal for frequent travelers.",NILL,All dues must be paid on time; rewards program subject to change.,"Professional Indemnity Insurance, 8 complimentary visits per year to Domestic Airport Lounges in India",False,False,False,False,"Free movie tickets, shopping vouchers",False,False,True,False,False,True
SBI,CASHBACK SBI Card,Retail,Cashback,"5% Cashback on online spends without any merchant restriction, 1% Cashback on offline spends",https://www.sbicard.com/sbi-card-en/assets/media/images/personal/credit-cards/network-card-images/240759_SBI_Cashback_139-x-218px-01.png,https://sbicard.com/en/personal/credit-cards/rewards/cashback-sbi-card.page,https://www.sbicard.com/sprint/cashback?CS=sbic,Rs. 999,Rs. 999,"Renewal Fee reversed if annual spends for last year >= Rs. 2,00,000",NILL,NILL,NILL,NILL,NILL,NILL,NILL,NILL,NILL,NILL,NILL,NILL,NILL,NILL,NILL,NILL,NILL,Earn 5% Cashback on online spends and 1% on offline spends,Yes,Reversal of Renewal Fee on annual spends of Rs.2 Lakh,NILL,False,NILL,"Contactless payments, Fuel Surcharge Waiver, Worldwide Acceptance",NILL,False,False,False,False,1% Fuel Surcharge Waiver across all petrol pumps in India,NILL,NILL,NILL,NILL,NILL,NILL,NILL,NILL,NILL,NILL,NILL,False,NILL,False,NILL,NILL,NILL,False,"This card offers cashback on online and offline spends, making it ideal for everyday purchases.",NILL,All dues must be paid on time; rewards program subject to change.,"Contactless payments, Fuel Surcharge Waiver, Worldwide Acceptance",True,False,False,False,NILL,False,False,False,False,False,False
SBI,SBI Card PRIME,Retail,Rewards,"Welcome e-gift Voucher worth Rs. 3,000 from various brands and 10 Reward Points per Rs. 100 spent on Dining, Groceries, Departmental stores and Movies.",https://www.sbicard.com/sbi-card-en/assets/media/images/personal/credit-cards/network-card-images/Prime_349x218-px-Front.png,https://sbicard.com/en/personal/credit-cards/rewards/sbi-card-prime.page,https://bankbazaar.com/credit-card.html?variant=slide,"Rs. 2,999 + Taxes","Rs. 2,999 + Taxes",Waiver of Renewal Fee on annual spends of Rs. 3 Lakhs,Nil,45% per annum,NILL,₹250,NILL,NILL,NILL,2.5% of the amount withdrawn or ₹500,"From ₹0 to ₹500 - Nil; More than ₹500 up to ₹1,000 - ₹400; More than ₹1,000 up to ₹10,000 - ₹750; More than ₹10,000 up to ₹25,000 - ₹950; More than ₹25,000 up to ₹50,000 - ₹1,100; More than ₹50,000 - ₹1,300",2.5% of the over limit amount; minimum of ₹600,3.50%,₹99,NILL,NILL,NILL,NILL,NILL,"Get 10 Reward Points per Rs. 100 spent on Dining, Groceries, Departmental stores and Movies; 2 Reward Points per Rs. 100 on all other retail spends except fuel.",1% Fuel Surcharge Waiver on transaction amount ranging from Rs. 500- Rs. 4000 across all petrol pumps.,Annual fee reversed if spends > ₹1 lakh/year,"Yes, on spends above ₹2,500",False,"Free movie tickets, shopping vouchers, Pizza Hut e-Voucher worth Rs. 1,000 on achieving spends of Rs. 50,000 in a calendar quarter.","4 complimentary visits per calendar year to International Priority Pass Lounges, 8 complimentary visits per calendar year to Domestic Lounges in India, Contactless payments.",NILL,False,False,False,False,1% Fuel Surcharge Waiver on transaction amount ranging from Rs. 500-Rs.4000 across all petrol pumps.,20% off at select restaurants.,NILL,"Free travel insurance, airport transfers.",Buy 1 Get 1 free ticket monthly.,3 months free Netflix,NILL,"₹500 Myntra voucher on spends > ₹50,000.",Extra points on app transactions.,10% off at partner hotels.,Free gym membership.,2% cashback on Amazon/Flipkart.,True,24x7 concierge for travel bookings.,False,Zero liability if reported within 24 hours.,NILL,"Chip and PIN, contactless, 2FA.",True,"This card offers premium travel, shopping, and lifestyle benefits, including lounge access, high rewards, and robust insurance, making it ideal for frequent travelers.",You must be between 18 - 80 years of age; add-on credit cardholder must be above 18 years; the applicant can be a resident as well as a non-resident of India.,All dues must be paid on time; rewards program subject to change.,"4 complimentary visits per calendar year to International Priority Pass Lounges, 8 complimentary visits per calendar year to Domestic Lounges in India, Contactless payments.",False,False,False,False,"Free movie tickets, shopping vouchers, Pizza Hut e-Voucher worth Rs. 1,000 on achieving spends of Rs. 50,000 in a calendar quarter.",True,False,True,False,False,True
SBI,OLA Money SBI Card,Retail,Travel,7% Rewards on OLA rides and 1% on all other spends,https://www.sbicard.com/sbi-card-en/assets/media/images/personal/credit-cards/travel/ola-card/ola-card-face-front.png,https://www.sbicard.com/en/personal/credit-cards/travel/ola-money-sbi-card.page,https://www.sbicard.com/en/personal/credit-cards/travel/ola-money-sbi-card.page,NIL,Rs. 499,Renewal fee reversed on annual spends of Rs. 1 Lakh,NIL,NILL,NILL,NILL,NILL,NILL,NILL,NILL,NILL,NILL,NILL,NILL,NILL,NILL,NILL,1% Fuel Surcharge Waiver at fuel stations,NILL,Earn 7% Reward Points on all Ola rides and 1% on all other spends,NILL,NILL,"Yes, on spends above ₹2,500",False,"Free movie tickets, shopping vouchers","Worldwide acceptance, Add-on cards, Utility bill payment, Balance transfer on EMI, Flexipay, Easy Money Facility",NILL,False,False,False,False,1% fuel surcharge waiver,NILL,NILL,"Free travel insurance, airport transfers",Buy 1 Get 1 free ticket monthly,NILL,NILL,NILL,Extra points on app transactions,NILL,Free gym membership,2% cashback on Amazon/Flipkart,False,NILL,False,Zero liability if reported within 24 hours,NILL,NILL,False,"This card offers premium travel, shopping, and lifestyle benefits, including lounge access, high rewards, and robust insurance, making it ideal for frequent travelers.",NILL,All dues must be paid on time; rewards program subject to change.,"Worldwide acceptance, Add-on cards, Utility bill payment, Balance transfer on EMI, Flexipay, Easy Money Facility",False,False,False,False,"Free movie tickets, shopping vouchers",False,False,True,False,False,True
SBI Card,Apollo SBI Card SELECT,Retail,Health & Wellness,Up to 25% value back on health-related spends across Apollo 24|7 and Apollo Pharmacy,https://www.sbicard.com/sbi-card-en/assets/media/images/personal/credit-cards/card-dispute/card-face/apollo-front.png,https://www.sbicard.com/en/personal/credit-cards/rewards/apollo-sbi-card-select.page,https://www.sbicard.com/sprint/ApolloSelect?ch=dis&GEMID1=prod_apolloselect_org_hp_banner&GEMID2=org_apolloselect_prod,"Rs. 1,499 + GST","Rs. 1,499 + GST",Annual fee reversed on spending Rs. 3 lakh in previous membership year,Nil,NILL,NILL,NILL,NILL,NILL,NILL,NILL,NILL,NILL,NILL,NILL,NILL,NILL,NILL,NILL,NILL,"Earn 10 Reward Points per Rs.100 spent on Apollo 24|7 and Apollo Pharmacy; 2 Reward Points per Rs.100 spent on Dining, Movies & Entertainment, and Travel; 1 Reward Point per Rs.200 spent on other purchases.",NILL,Annual fee reversed on spending Rs. 3 lakh or more,"Yes, on spends above Rs. 2,500",False,"Complimentary health check-ups, discounts on consultations, and wellness programs.","4 complimentary domestic lounge visits per year, complimentary Priority Pass Membership worth $99, 1% fuel surcharge waiver on fuel transactions between Rs. 500 and Rs. 4,000.",NILL,False,False,False,False,"1% fuel surcharge waiver on fuel transactions between Rs. 500 and Rs. 4,000.",NILL,NILL,NILL,NILL,NILL,NILL,NILL,NILL,NILL,NILL,NILL,True,NILL,False,NILL,Complimentary health check-ups and wellness programs.,Chip and PIN enabled for enhanced security.,False,"The Apollo SBI Card SELECT offers health-conscious consumers a unique blend of healthcare benefits and financial rewards, making it ideal for those focused on wellness and lifestyle.",NILL,All dues must be paid on time; rewards program subject to change.,"4 complimentary domestic lounge visits per year, complimentary Priority Pass Membership worth $99, 1% fuel surcharge waiver on fuel transactions between Rs. 500 and Rs. 4,000.",True,False,False,False,"Complimentary health check-ups, discounts on consultations, and wellness programs.",False,False,False,False,False,False
SBI,SBI Card PRIME,Retail,Rewards,"Welcome e-Gift Voucher worth ₹3,000 on joining, Spend linked Gift Vouchers worth ₹11,000, 10 Reward Points per ₹100 spent on Dining, Groceries, Departmental stores and Movies, Complimentary International and Domestic Airport Lounge access",https://www.sbicard.com/sbi-card-en/assets/media/images/personal/credit-cards/network-card-images/Prime_349x218-px-Front.png,https://www.sbicard.com/en/personal/credit-cards/rewards/sbi-card-prime.page,https://sbicard.com/en/eapply/eapplyform.page?path=personal/credit-cards/rewards/sbi-card-prime.dcr,NILL,NILL,NILL,NILL,NILL,NILL,NILL,NILL,NILL,NILL,NILL,NILL,NILL,NILL,NILL,NILL,NILL,NILL,NILL,NILL,"10 Reward Points per ₹100 spent on Dining, Groceries, Departmental stores and Movies",NILL,NILL,NILL,False,NILL,Complimentary International and Domestic Airport Lounge access,NILL,False,False,False,False,NILL,NILL,NILL,NILL,NILL,NILL,NILL,NILL,NILL,NILL,NILL,NILL,True,NILL,False,NILL,NILL,NILL,True,"This card offers premium travel, shopping, and lifestyle benefits, including lounge access, high rewards, and robust insurance, making it ideal for frequent travelers.",NILL,All dues must be paid on time; rewards program subject to change.,Complimentary International and Domestic Airport Lounge access,False,False,False,False,NILL,False,False,False,False,False,False
SBI,Tata Card SELECT,Retail,Shopping,2% valueback on spends at croma & 3X points on Departmental Stores & Grocery,https://www.tatacard.com/tata-card-en/assets/media/images/personal/credit-cards/premium-cards/card-faces/tata-platinum-card.jpg,https://www.tatacard.com/tata-en/personal/credit-cards/premium-cards/tata-platinum-card.page,https://www.tatacard.com/tata-en/eapply/eapplyform.page?path=personal/credit-cards/premium-cards/tata-platinum-card.dcr,NILL,NILL,NILL,NILL,NILL,NILL,NILL,NILL,NILL,NILL,NILL,NILL,NILL,NILL,NILL,NILL,NILL,NILL,NILL,NILL,NILL,NILL,NILL,NILL,False,NILL,NILL,NILL,False,False,False,False,NILL,NILL,NILL,NILL,NILL,NILL,NILL,NILL,NILL,NILL,NILL,NILL,False,NILL,False,NILL,NILL,NILL,False,NILL,NILL,NILL,NILL,False,False,False,False,NILL,False,False,False,False,False,False
SBI,Tata Neu Plus SBI Card,Retail,Lifestyle,"Earn NeuCoins on every spend, exciting rewards, lifestyle benefits, and more.",https://www.sbicard.com/sbi-card-en/assets/media/images/personal/credit-cards/rewards/card-faces/tata-titanium-dec.png,https://www.sbicard.com/en/personal/credit-cards/lifestyle/tata-neu-plus-sbi-card.page#,https://www.sbicard.com/en/personal/credit-cards/lifestyle/tata-neu-plus-sbi-card.page#,Rs. 499 + Taxes,Rs. 499 + Taxes,Annual Fee reversal on annual spends of 1 Lakh or more,Nil,NILL,NILL,NILL,NILL,NILL,NILL,NILL,NILL,NILL,NILL,NILL,NILL,NILL,NILL,"1% fuel surcharge across all petrol pumps in India, on transactions from Rs. 500 up to Rs. 4,000, exclusive of GST and other charges",NILL,2% Value back as NeuCoins on spends on Tata Neu App/Website and partner Tata Brands,"1% Value back as NeuCoins on other spends, including UPI transactions",Annual Fee reversal on annual spends of 1 Lakh or more,"Yes, on spends above ₹2,500",False,"Free movie tickets, shopping vouchers","4 complimentary domestic airport lounge access / year (1 per quarter, applicable on achieving Rs. 50,000 spends in previous quarter)",NILL,False,False,True,False,1% fuel surcharge waiver,NILL,NILL,NILL,NILL,NILL,NILL,NILL,Extra points on app transactions,NILL,Free gym membership,2% cashback on Amazon/Flipkart,True,NILL,False,Zero liability if reported within 24 hours,NILL,"chip & PIN, contactless, 2FA",False,"This card offers premium travel, shopping, and lifestyle benefits, including lounge access, high rewards, and robust insurance, making it ideal for frequent travelers.",NILL,All dues must be paid on time; rewards program subject to change.,"4 complimentary domestic airport lounge access / year (1 per quarter, applicable on achieving Rs. 50,000 spends in previous quarter)",False,False,False,False,"Free movie tickets, shopping vouchers",False,False,True,False,False,True
