HDFC Bank,InterMiles HDFC Bank Platinum Credit Card,Travel and Lifestyle,NILL,"Up to 3,000 Bonus InterMiles and discounts on flight and hotel bookings",https://www.hdfcbank.com/content/api/contentstream-id/723fb80a-2dde-42a3-9793-7ae1be57c87f/c0c80500-23b9-42fc-9f6d-23efb8a503b4/Personal/Pay/Cards/Credit%20Card/Credit%20Card%20Landing%20Page/Credit%20Cards/Co-Brand/JetPrivilege%20HDFC%20Bank%20Platinum%20Credit%20Card/Card%20Facia/2C-Product-Page-264x167-InterMiles-Platinum.png,https://www.hdfcbank.com/personal/pay/cards/credit-cards/intermiles-hdfc-bank-platinum-credit-card,https://www.hdfcbank.com/personal/pay/cards/credit-cards/intermiles-hdfc-bank-platinum-credit-card,NILL,NILL,Spend Rs. 2.5 lac within 12 months to waive off renewal fee,NILL,3.6% per month,NILL,NILL,NILL,NILL,NILL,NILL,NILL,NILL,NILL,NILL,NILL,NILL,NILL,NILL,NILL,Earn 4 InterMiles on every Rs. 150 spent,NILL,NILL,NILL,False,NILL,"Complimentary lounge access, discounts on flight and hotel bookings, and bonus InterMiles on spending",NILL,False,False,True,False,1% fuel surcharge waiver at all fuel stations,Save up to 20% on dining bills,NILL,Discounts on flight and hotel bookings,NILL,NILL,NILL,NILL,NILL,NILL,NILL,NILL,True,NILL,False,Zero liability on lost card,NILL,"Chip & PIN, contactless payments",False,"The InterMiles HDFC Bank Platinum Credit Card offers premium travel and lifestyle benefits, including bonus InterMiles, discounts on flights and hotels, and complimentary lounge access, making it ideal for frequent travelers.","Salaried: Age 21-60, Income > Rs 30,000; Self-employed: Age 21-65, ITR > Rs 6 Lakhs per annum",All dues must be paid on time; rewards program subject to change.,"Complimentary lounge access, discounts on flight and hotel bookings, and bonus InterMiles on spending",False,False,False,True,NILL,False,False,False,False,False,False
HDFC Bank,Diners Club Miles Credit Card,Credit Card,Travel,Complimentary access to 1000+ lounges worldwide and 4 Reward Points for every ₹150 spent,https://www.hdfcbank.com/content/api/contentstream-id/723fb80a-2dde-42a3-9793-7ae1be57c87f/78fc1970-c18e-44ef-9ad4-2634eb9d403c/Personal/Pay/Cards/Credit%20Card/Credit%20Card%20Landing%20Page/Credit%20Cards/Diners%20Club%20Miles/diners_club_miles_banner1.png,https://www.hdfcbank.com/personal/pay/cards/credit-cards/diners-club-miles,,NILL,"₹1,000",Get renewal fee waived off on annual spends of ₹1 Lakh,NILL,3.6%,NILL,NILL,NILL,NILL,NILL,2.5% (min ₹500),NILL,NILL,3.5%,NILL,NILL,NILL,NILL,NILL,NILL,Earn 4 Reward Points for every ₹150 spent,NILL,NILL,NILL,False,"Complimentary access to lounges, travel insurance, and more","Complimentary lounge access, concierge service, and insurance coverage",NILL,False,False,False,False,NILL,15% discount at select restaurants,NILL,Complimentary lounge access and travel insurance,NILL,NILL,NILL,NILL,NILL,NILL,NILL,NILL,True,Available for travel needs,True,NILL,NILL,Chip-enabled card for secure transactions,False,"The Diners Club Miles Credit Card offers premium travel, shopping, and lifestyle benefits, including lounge access, high rewards, and robust insurance, making it ideal for frequent travelers.",NILL,NILL,"Complimentary lounge access, concierge service, and insurance coverage",False,False,False,False,"Complimentary access to lounges, travel insurance, and more",False,False,False,True,False,False
HDFC Bank,Diners Club Privilege Credit Card,Premium,"Travel, Dining, Shopping","5X Reward Points on Swiggy and Zomato, Complimentary Annual Memberships of Swiggy One and Times Prime",https://www.hdfcbank.com/content/api/contentstream-id/723fb80a-2dde-42a3-9793-7ae1be57c87f/2ec55b78-5c0e-448a-83d6-d48da1c70c5b/Personal/Pay/Cards/Credit%20Card/Credit%20Card%20Landing%20Page/Credit%20Cards/Super%20Premium/Diners%20Club%20Privilege%20New/Diners-Privilege-Card-Product-page-264%20x%20167.png,https://hdfcbank.com/personal/pay/cards/credit-cards/diners-privilege,https://applyonline.hdfcbank.com/cards/credit-cards.html?utm_content=MKTG&mc_id=website_organic_dc&icid=website_organic_dc#nbb,1000,NILL,NILL,NILL,NILL,NILL,NILL,NILL,NILL,NILL,NILL,NILL,NILL,3.5%,NILL,NILL,NILL,NILL,NILL,NILL,Earn 4 Reward Points on every ₹150 spent,NILL,NILL,Yes,False,"Complimentary Annual Memberships of Swiggy One and Times Prime, ₹1,500 worth vouchers on quarterly spends of Rs. 1.5 lakh","2 Complimentary Airport lounge access every calendar quarter worldwide, 'Buy 1 Get 1 Free' on movie/non-movie weekend tickets via BookMyShow",NILL,False,False,False,False,NILL,20% off at select restaurants,NILL,Upto 10X Rewards on Booking flight tickets / stays across 150+ hotels,'Buy 1 Get 1 Free' on movie/non-movie weekend tickets via BookMyShow,NILL,NILL,NILL,NILL,NILL,NILL,NILL,True,NILL,False,NILL,NILL,"Contactless payments, chip & PIN",False,"This card offers premium travel, shopping, and lifestyle benefits, including lounge access, high rewards, and robust insurance, making it ideal for frequent travelers.","For Salaried Indian national: Age: Min 21 years & Max 60 Years, Net Monthly Income> Rs 35,000; For Self Employed Indian national: Age: Min 21 years & Max 65 Years, Income: ITR > Rs 6 Lakhs per annum",NILL,"2 Complimentary Airport lounge access every calendar quarter worldwide, 'Buy 1 Get 1 Free' on movie/non-movie weekend tickets via BookMyShow",False,True,False,False,"Complimentary Annual Memberships of Swiggy One and Times Prime, ₹1,500 worth vouchers on quarterly spends of Rs. 1.5 lakh",True,False,True,False,False,False
IDFC FIRST Bank,Ashva Credit Card,Retail,Lifestyle,"A Metal Credit Card with premium travel, shopping, and lifestyle benefits, including lounge access, high rewards, and robust insurance.",https://www.idfcfirstbank.com/content/dam/idfcfirstbank/images/cc-new-revamp/CC-new-image-Group-1171284808.jpg,https://www.idfcfirstbank.com/credit-card/metal-credit-card/ashva#,https://www.idfcfirstbank.com/credit-card/metal-credit-card/ashva#,"₹2,999+GST","₹2,999+GST",NILL,NILL,NILL,NILL,NILL,NILL,NILL,NILL,NILL,NILL,NILL,1%,NILL,NILL,NILL,NILL,NILL,NILL,Earn Up to 60X Reward Points Redemption value of up to ₹0.40 per Reward Point,1% cashback on all spends,Annual fee reversed if spends > ₹1 lakh/year,"Yes, on spends above ₹2,500",False,"Free movie tickets, shopping vouchers","Contactless payments, lounge access",NILL,False,False,False,False,1% fuel surcharge waiver,20% off at select restaurants,NILL,"Complimentary access to airport lounges 4 times in India & 2 times overseas, every quarter",Buy 1 Get 1 free ticket monthly,3 months free Netflix,NILL,"₹500 Myntra voucher on spends > ₹50,000",Extra points on app transactions,10% off at partner hotels,Free gym membership,2% cashback on Amazon/Flipkart,True,24x7 concierge for travel bookings,False,Zero liability if reported within 24 hours,NILL,"chip & PIN, contactless, 2FA",False,"This card offers premium travel, shopping, and lifestyle benefits, including lounge access, high rewards, and robust insurance, making it ideal for frequent travelers.",NILL,All dues must be paid on time; rewards program subject to change.,"Contactless payments, lounge access",False,False,False,False,"Free movie tickets, shopping vouchers",False,False,True,False,False,True
IDFC FIRST Bank,Mayura Credit Card,Retail,Lifestyle,"0% forex markup on international transactions, complimentary airport lounge access, and premium rewards.",https://www.idfcfirstbank.com/content/dam/idfcfirstbank/images/cc-new-revamp/content-img/CCL-Front-Mayura-image.jpg,https://www.idfcfirstbank.com/credit-card/metal-credit-card/mayura#,https://www.idfcfirstbank.com/credit-card/metal-credit-card/mayura#,"₹5,999+GST","₹5,999+GST",NILL,NILL,NILL,NILL,NILL,NILL,NILL,NILL,₹199+GST,NILL,NILL,NILL,NILL,NILL,NILL,NILL,NILL,NILL,Earn up to 60X Reward Points,1% cashback on all spends,Annual fee reversed if spends > ₹1 lakh/year,"Yes, on spends above ₹2,500",False,"Free movie tickets, shopping vouchers","Contactless payments, lounge access",NILL,False,False,False,False,1% fuel surcharge waiver,20% off at select restaurants,Chef's table invitations,"Free travel insurance, airport transfers",Buy 1 Get 1 free ticket monthly,3 months free Netflix,NILL,"₹500 Myntra voucher on spends > ₹50,000",Extra points on app transactions,10% off at partner hotels,Free gym membership,2% cashback on Amazon/Flipkart,True,24x7 concierge for travel bookings,False,Zero liability if reported within 24 hours,NILL,"chip & PIN, contactless, 2FA",False,"This card offers premium travel, shopping, and lifestyle benefits, including lounge access, high rewards, and robust insurance, making it ideal for frequent travelers.",NILL,All dues must be paid on time; rewards program subject to change.,"Contactless payments, lounge access",False,False,False,False,"Free movie tickets, shopping vouchers",False,False,True,False,False,True
IDFC FIRST Bank,FIRST EA₹N RuPay Credit Card,Retail,Cashback,Earn up to 1% cashback on every spend,https://www.idfcfirstbank.com/content/dam/idfcfirstbank/images/cc-new-revamp/content-img/First-earn-card-image.png,https://www.idfcfirstbank.com/credit-card/secured-rupay-credit-card,https://www.idfcfirstbank.com/content/idfcfirstbank/en/credit-card/ntb-diy/cashback-card-standalone?utm_source=website,₹499 + GST,₹499 + GST,100% cashback up to ₹500 on your first UPI transaction,,8.5% - 46.2%,,,,,,,,,,,,,,,,Earn 1% cashback on every spend via the IDFC FIRST Bank mobile app,"1% cashback on UPI spends via IDFC FIRST Bank app, 0.5% on other UPI apps",Annual fee reversed if spends > ₹1 lakh/year,"Yes, on spends above ₹2,500",False,"Cashback on every spend, discounts on movie tickets","UPI enabled, cashback on utility payments, easy EMI conversion",,False,False,True,False,,,,,,,,,,,,,False,,False,Zero liability if reported within 24 hours,,"Chip & PIN, contactless payments",False,"The FIRST EA₹N RuPay Credit Card offers cashback on every spend, UPI convenience, and is backed by a fixed deposit, making it ideal for those without a credit history.","Age 18 years or above, Indian citizen, must hold a fixed deposit with IDFC FIRST Bank of minimum ₹5,000",All dues must be paid on time; rewards program subject to change.,"UPI enabled, cashback on utility payments, easy EMI conversion",False,False,False,False,"Cashback on every spend, discounts on movie tickets",True,True,False,False,False,True
IDFC FIRST Bank,FIRST Select Debit Card,Retail,Lifestyle,"Complimentary Lounge access for you & companion, Enhanced Withdrawal and transaction limits, Road Side Assistance, Premium lifestyle benefits",https://www.idfcfirstbank.com/content/dam/idfcfirstbank/images/cc-new-revamp/content-img/millennia-range.png,https://www.idfcfirstbank.com/personal-banking/payments/cards/debit-card/visa-select-debit-card,https://www.idfcfirstbank.com/credit-card/ntb-diy/apply?cardType=EAVC&utm_source=website,NILL,NILL,NILL,NILL,NILL,NILL,NILL,NILL,NILL,NILL,NILL,NILL,NILL,NILL,NILL,NILL,NILL,NILL,NILL,NILL,NILL,NILL,NILL,NILL,False,NILL,"Complimentary Lounge access for you & companion, Enhanced Withdrawal and transaction limits, Road Side Assistance, Premium lifestyle benefits",NILL,False,False,False,False,NILL,NILL,NILL,NILL,NILL,NILL,NILL,NILL,NILL,NILL,NILL,NILL,True,NILL,False,NILL,NILL,NILL,False,"Enter a superior lifestyle with a FIRST Select card that comes with an unending array of benefits, rewards and discounts designed only for a select few.",NILL,NILL,"Complimentary Lounge access for you & companion, Enhanced Withdrawal and transaction limits, Road Side Assistance, Premium lifestyle benefits",False,False,False,False,NILL,False,False,False,False,False,False
IDFC FIRST Bank,FIRST SWYP Credit Card,Retail,Shopping,Convert transactions and balances to affordable EMIs with no interest charges.,https://www.idfcfirstbank.com/content/dam/idfcfirstbank/images/cc-new-revamp/content-img/swyp-range.png,https://www.idfcfirstbank.com/credit-card/swyp-emi-credit-card,https://www.idfcfirstbank.com/credit-card/ntb-diy/apply?cardType=FSWM,₹499 + GST,₹499 + GST,"Spend ₹5,000 within 30 days to get a ₹500 Amazon voucher and 1,000 reward points on first EMI conversion.",NILL,NILL,NILL,NILL,NILL,NILL,NILL,₹199 + GST,NILL,NILL,NILL,NILL,NILL,NILL,NILL,NILL,NILL,"Earn 200 reward points on spending ₹5,000, 500 points on ₹10,000, and 1,000 points on ₹15,000 monthly spends.",NILL,"Annual fee waived on spending ₹5,000 within 45 days of annual fee levy.","Yes, on spends above ₹2,500.",False,"Discounts on various brands, cashback offers, and referral benefits.","EMI conversion, cashback on UPI spends, complimentary railway lounge access, and roadside assistance.",NILL,False,False,True,False,1% fuel surcharge waiver up to ₹200 per month.,NILL,NILL,Complimentary railway lounge access and travel insurance.,25% discount on movie tickets up to ₹100.,NILL,NILL,"Discounts on partner brands like Zomato, EaseMyTrip, and more.",Exclusive offers and rewards through the IDFC FIRST Bank mobile app.,NILL,NILL,NILL,True,NILL,False,Zero liability on unauthorized transactions if reported within 24 hours.,NILL,"Chip & PIN, contactless payments, and 2FA.",False,"The FIRST SWYP Credit Card offers a unique way to manage your expenses with easy EMI options, cashback rewards, and a host of lifestyle benefits, making it ideal for everyday spending and travel.","Age, income, and credit score requirements apply.",All dues must be paid on time; rewards program subject to change.,"EMI conversion, cashback on UPI spends, complimentary railway lounge access, and roadside assistance.",False,False,False,False,"Discounts on various brands, cashback offers, and referral benefits.",False,True,False,False,False,False
IDFC FIRST Bank,IDFC FIRST WOW! Credit Card,Retail,Travel,"Zero Forex Markup Fees, Lifetime-Free, FD-Backed Premium Credit Card",https://www.idfcfirstbank.com/content/dam/idfcfirstbank/images/first-cc-rewamp/classic-card.png,https://www.idfcfirstbank.com/credit-card/wow,https://www.idfcfirstbank.com/credit-card/ntb-diy/secure-card-standalone?utm_campaign=website,₹0,₹0,NILL,NILL,8.5% - 46.2% per annum,NILL,NILL,NILL,NILL,NILL,₹199 + GST,NILL,NILL,0%,NILL,NILL,NILL,NILL,NILL,NILL,Earn 4X Reward Points on every travel spend,NILL,NILL,NILL,False,"Free movie tickets, shopping vouchers","No income proof required, Instant Issuance, Fully Digital Online Application",NILL,False,False,False,False,NILL,NILL,NILL,"Free travel insurance, airport transfers",Buy 1 Get 1 free ticket monthly,NILL,NILL,NILL,Extra points on app transactions,NILL,Free gym membership,2% cashback on Amazon/Flipkart,False,24x7 concierge for travel bookings,False,Zero liability if reported within 24 hours,NILL,"chip & PIN, contactless, 2FA",False,"This card offers premium travel, shopping, and lifestyle benefits, including lounge access, high rewards, and robust insurance, making it ideal for frequent travelers.","At least 18 years of age, Be an Indian citizen with a permanent address in India, Minimum FD amount of ₹20,000 created during the credit card application process online",All dues must be paid on time; rewards program subject to change.,"No income proof required, Instant Issuance, Fully Digital Online Application",False,False,False,False,"Free movie tickets, shopping vouchers",False,False,True,False,False,True
IDFC FIRST Bank,FIRST Power+ Credit Card,Retail,Fuel,"Save up to ₹18,500 annually with this credit card, enough to buy you 175+ litres of fuel",https://www.idfcfirstbank.com/content/dam/idfcfirstbank/images/cc-new-revamp/content-img/power-range.png,https://www.idfcfirstbank.com/credit-card/hpcl-power-fuel-credit-card,https://www.idfcfirstbank.com/credit-card/ntb-diy/apply?cardType=RPLP&utm_source=website,₹499,₹499,"Annual fee reversed on spends of ₹1,50,000 or more in a year",NILL,8.5% to 46.2% per annum,NILL,NILL,NILL,NILL,NILL,₹199,15% of Total Amount Due (subject to a minimum of ₹100 and a maximum of ₹1300),2.5% of the over-limit amount subject to a minimum charge of ₹550,NILL,NILL,NILL,NILL,NILL,NILL,NILL,3X Rewards on UPI and other retail transactions,"5% cashback (up to ₹1,000) on the transaction value of 1st EMI conversion","Annual fee reversed on spends of ₹1,50,000 or more in a year","Yes, on spends above ₹2,500",False,"Exciting merchant offers worth ₹1,000+","Complimentary Domestic Airport Lounge access, once every quarter, on minimum monthly spends of ₹20,000",NILL,False,False,True,False,Up to 6.5% savings on your fuel expenses,"25% off on movie tickets up to ₹100, once every month",NILL,Up to 8.83% savings on hotel & flight bookings through IDFC FIRST Mobile App,NILL,NILL,NILL,NILL,Extra points on app transactions,10% off at partner hotels,Free gym membership,2% cashback on Amazon/Flipkart,True,24x7 concierge for travel bookings,False,Zero liability if reported within 24 hours,NILL,"chip & PIN, contactless, 2FA",False,"This card offers premium travel, shopping, and lifestyle benefits, including lounge access, high rewards, and robust insurance, making it ideal for frequent travelers.","You must be at least 21 years old, an Indian citizen, have a healthy credit score, and an Annual Income of ₹3 lacs or more.",All dues must be paid on time; rewards program subject to change.,"Complimentary Domestic Airport Lounge access, once every quarter, on minimum monthly spends of ₹20,000",False,False,False,False,"Exciting merchant offers worth ₹1,000+",False,False,False,False,False,False
IDFC FIRST Bank,FIRST Select Credit Card,Lifestyle,Travel,Lifetime free credit card with unlimited airport lounge access and 10X reward points on select categories.,https://www.idfcfirstbank.com/content/dam/idfcfirstbank/images/cc-new-revamp/content-img/lic-range.png,https://idfcfirstbank.com/credit-card/select,https://idfcfirstbank.com/credit-card/ntb-diy/apply?utm_source=website,NILL,NILL,NILL,NILL,From 8.5% - 46.2% per annum,NILL,NILL,NILL,NILL,NILL,0% Interest for up to 45 days ₹199 + GST per transaction,NILL,NILL,1.99%,NILL,NILL,NILL,NILL,1% Fuel surcharge waiver,NILL,"Earn 10X reward points on spends above ₹20,000 per statement cycle and 3X on other spends.","Up to ₹1,000 cashback on first EMI transaction within 30 days of card generation.",NILL,"Yes, on spends above ₹2,500.",False,"Complimentary airport lounge access, Buy-1-Get-1 movie ticket offers, discounts on dining and shopping.","Lifetime free, low forex markup, comprehensive insurance coverage, and 24/7 roadside assistance.",NILL,False,False,False,False,1% fuel surcharge waiver up to ₹300 in a statement cycle.,Discounts of up to 20% in over 1500 restaurants.,NILL,Complimentary domestic airport lounge access and railway lounge visits.,Buy-1-Get-1 movie ticket offers.,NILL,NILL,NILL,Exclusive offers and rewards through the mobile app.,NILL,Over 300+ merchant offers across various categories.,NILL,False,Travel concierge services available.,True,NILL,NILL,NILL,True,"The FIRST Select Credit Card offers premium travel, shopping, and lifestyle benefits, including lounge access, high rewards, and robust insurance, making it ideal for frequent travelers.","Annual income of ₹12 lakhs or more, age 18 years or older, good credit score, Indian resident.",All dues must be paid on time; rewards program subject to change.,"Lifetime free, low forex markup, comprehensive insurance coverage, and 24/7 roadside assistance.",False,False,False,False,"Complimentary airport lounge access, Buy-1-Get-1 movie ticket offers, discounts on dining and shopping.",False,False,False,False,False,True
IDFC FIRST Bank,FIRST Wealth Credit Card,Premium,"Travel, Lifestyle, Shopping",Lifetime free card with premium benefits including low forex markup and complimentary lounge access,https://www.idfcfirstbank.com/content/dam/idfcfirstbank/images/first-cc-rewamp/select-card.png,https://www.idfcfirstbank.com/credit-card/wealth,https://www.idfcfirstbank.com/credit-card/ntb-diy/apply?utm_source=website&utm_medium=wealth_productpage&utm_campaign=formfield_september2024,NIL,NIL,NILL,NILL,0.75% to 3.5% per month (8.5% to 46.2% per annum),NILL,NILL,NILL,NILL,NILL,₹199 per transaction,NILL,NILL,1.5% + GST,₹99 + GST,NILL,NILL,NILL,NILL,NILL,"3X Reward Points on spends up to ₹20,000, 10X on incremental spends above ₹20,000 and on birthday","5% cashback (up to ₹1,000) on first EMI transaction within 30 days",NILL,"Available on transactions above ₹2,500",False,"Complimentary lounge access, cashback offers, and more","Lifetime free, low forex markup, complimentary golf rounds, and travel insurance",NILL,False,False,False,False,1% fuel surcharge waiver up to ₹400,Up to 20% off at 1500+ restaurants,NILL,"Complimentary airport lounge access, travel insurance",Buy 1 Get 1 movie ticket offer up to ₹250,NILL,NILL,NILL,"Manage card, track rewards, and redeem points via app",Discounts at luxury hotels,NILL,NILL,False,Personalized concierge service available,True,NILL,NILL,NILL,True,"The IDFC FIRST Wealth Credit Card offers premium travel, shopping, and lifestyle benefits, including lounge access, high rewards, and robust insurance, making it ideal for frequent travelers.",Annual income of ₹36 lakhs or more,NILL,"Lifetime free, low forex markup, complimentary golf rounds, and travel insurance",False,False,False,True,"Complimentary lounge access, cashback offers, and more",False,True,False,False,False,False
IDFC FIRST Bank,IDFC FIRST WOW! Credit Card,Retail,Travel,"Zero Forex Markup Fees, Lifetime-Free, FD-Backed Premium Credit Card",https://www.idfcfirstbank.com/content/dam/idfcfirstbank/images/first-cc-rewamp/wealth-card.png,https://idfcfirstbank.com/credit-card/wow,https://idfcfirstbank.com/credit-card/ntb-diy/secure-card-standalone?utm_campaign=website,₹0,₹0,NILL,NILL,8.5% - 46.2% per annum,NILL,NILL,NILL,NILL,NILL,₹199 + GST,NILL,NILL,0%,NILL,NILL,NILL,NILL,NILL,NILL,Earn 4X Reward Points on every travel spend,NILL,NILL,NILL,False,"Free movie tickets, shopping vouchers","No credit history or income proof required, Instant Issuance, Fully Digital Online Application",NILL,False,False,False,False,NILL,NILL,NILL,"Free travel insurance, airport transfers",Buy 1 Get 1 free ticket monthly,3 months free Netflix,NILL,"₹500 Myntra voucher on spends > ₹50,000",Extra points on app transactions,10% off at partner hotels,Free gym membership,2% cashback on Amazon/Flipkart,False,24x7 concierge for travel bookings,False,Zero liability if reported within 24 hours,NILL,"chip & PIN, contactless, 2FA",False,"This card offers premium travel, shopping, and lifestyle benefits, including lounge access, high rewards, and robust insurance, making it ideal for frequent travelers.","At least 18 years of age, Be an Indian citizen with a permanent address in India, Minimum FD amount of ₹20,000 created during the credit card application process online",All dues must be paid on time; rewards program subject to change.,"No credit history or income proof required, Instant Issuance, Fully Digital Online Application",False,False,False,False,"Free movie tickets, shopping vouchers",False,False,True,False,False,True
IDFC FIRST Bank,FIRST WOW! Credit Card,Retail,Travel,Lifetime-free credit card with zero forex markup fees and 4X reward points on travel spends.,https://www.idfcfirstbank.com/content/dam/idfcfirstbank/images/cc-new-revamp/content-img/FIRST-WOW-new-banner-001.png,https://idfcfirstbank.com/credit-card/wow,https://idfcfirstbank.com/credit-card/ntb-diy/secure-card-standalone?utm_campaign=website,₹0,₹0,NILL,NILL,8.5% - 46.2% per annum,NILL,NILL,NILL,NILL,NILL,₹199 + GST,NILL,NILL,0%,NILL,NILL,NILL,NILL,NILL,NILL,Earn 4X Reward Points on every travel spend.,NILL,NILL,NILL,False,"Free movie tickets, shopping vouchers.","No income proof required, instant card issuance, global acceptance.",NILL,False,False,False,False,NILL,NILL,NILL,"Free travel insurance, airport transfers.",Buy 1 Get 1 free ticket monthly.,NILL,NILL,NILL,Extra points on app transactions.,10% off at partner hotels.,Free gym membership.,2% cashback on Amazon/Flipkart.,False,24x7 concierge for travel bookings.,False,Zero liability if reported within 24 hours.,NILL,"Chip & PIN, contactless, 2FA.",False,"This card offers premium travel, shopping, and lifestyle benefits, including lounge access, high rewards, and robust insurance, making it ideal for frequent travelers.","At least 18 years of age, Indian citizen with a permanent address in India, minimum FD amount of ₹20,000 created during the credit card application process online.",All dues must be paid on time; rewards program subject to change.,"No income proof required, instant card issuance, global acceptance.",False,False,False,False,"Free movie tickets, shopping vouchers.",False,False,True,False,False,True
