"Yes Bank","Yes Uni Gold X","Retail","Shopping","Earn 24K Gold with GoldX Credit Card","https://www.yesbank.in/content/published/api/v1.1/assets/CONTE31749D516FF442DB73D463B9277341A/native/uni-card-icon.png?channelToken=21f7ccfa2fc3401091938f541a6f8f2a","https://www.uni.cards/","https://www.uni.cards/","ZERO","ZERO","NILL","NILL","NILL","NILL","NILL","NILL","NILL","NILL","NILL","NILL","NILL","ZERO","NILL","NILL","NILL","NILL","NILL","NILL","Earn 1% Rewards","NILL","NILL","NILL","NILL","NILL","Lifetime Free, Zero Forex Markup, Upto 5x rewards at Uni Store","NILL","NILL","NILL","NILL","NILL","NILL","NILL","NILL","NILL","NILL","NILL","NILL","NILL","NILL","NILL","NILL","NILL","NILL","NILL","NILL","NILL","NILL","NILL","Yes, accepted worldwide","This card offers premium shopping benefits, including earning 24K Gold on spends, making it ideal for frequent shoppers.","NILL","All dues must be paid on time; rewards program subject to change."
"YES Bank","Rio RuPay Credit Card","Retail","Rewards","3% Rio coins on UPI transactions above Rs.100 and 1% on non-UPI transactions, cashback on all spends, and complimentary lounge visits.","https://www.yesbank.in/content/published/api/v1.1/assets/CONT983AB823A22B432796880CE063CB25FF/native/new-rio-cc-icon-image.png?channelToken=21f7ccfa2fc3401091938f541a6f8f2a","https://www.bankbazaar.com/credit-card/yes-bank-rio-rupay-credit-card.html","https://www.bankbazaar.com/credit-card.html?variant=slide&WT.mc_id=CROSS_SELL_IL_CCBUTTON_bluesvg_213933&utm_source=bb&utm_medium=seo&utm_campaign=CROSS_SELL_IL_CCBUTTON_bluesvg_213933","Nil","Rs.399 + applicable taxes","Annual fee waived off if total retail spends amount to Rs.1,20,000 or more in a year","NILL","45.60% p.a.","NILL","NILL","NILL","NILL","NILL","NILL","Late payment fee varies based on amount due","NILL","NILL","NILL","NILL","1% fee + GST on education transactions made through third party websites, capped at Rs.5,000 per month","NILL","1% fee + GST on fuel transactions greater than Rs.10,000, capped at Rs.5,000 per month","1% + GST on utility transactions above Rs.15,000 a month, capped at Rs.3,000 per month","Earn 3% Rio coins on UPI transactions and 1% on non-UPI transactions","Yes","Annual fee reversed if spends > ₹1,20,000/year","NILL","3% Rio coins on UPI transactions, 1% on non-UPI transactions","Cashback on all spends, complimentary lounge visits","Convenient, easy to use, works on any payment method","NILL","NILL","NILL","NILL","NILL","1% fuel surcharge waiver","NILL","NILL","Two complimentary domestic lounge visits per calendar quarter","NILL","NILL","Assured cashback on UPI and non-UPI spends","NILL","NILL","NILL","NILL","NILL","Two complimentary domestic lounge visits in India per calendar quarter","NILL","NILL","NILL","NILL","NILL","NILL","This card offers cashback through Rio Coins on every spend, along with travel benefits and fuel surcharge waivers, making it ideal for frequent users.","Customer should be between 21 and 60 years of age, salaried or self-employed with a net salary of Rs.25,000 per month or income tax return of Rs.5 lakh.","All dues must be paid on time; rewards program subject to change."
"YES BANK","POP-CLUB Credit Card","Retail","Rewards","Earn POPcoins on every transaction","https://www.yesbank.in/content/published/api/v1.1/assets/CONTD9B3F02021314F189FE294CDF4734FD4/native/pop-club-cc-icon-image.png?channelToken=21f7ccfa2fc3401091938f541a6f8f2a","https://www.yesbank.in/personal-banking/yes-individual/cards/credit-cards/pop-club-credit-card","https://yesbank.getpopcard.co/","Zero Joining Fees","₹ 399+ applicable taxes","Spend ₹1,50,000 in card anniversary year and get waiver on renewal fee for the subsequent year","NILL","47.88% annually","NILL","NILL","NILL","NILL","NILL","NILL","NILL","NILL","NILL","NILL","NILL","1% fee + applicable GST on education transactions","Minimum 1% of transaction value or Rs 1 whichever is higher","1% fee + applicable GST on every fuel transaction of value greater than INR 10,000","1% + applicable GST on all utility transactions on Spends above INR 15,000 in a month","Earn 10 POPcoins for every ₹100 spent on Online Transactions","NILL","NILL","NILL","NILL","NILL","Secure payments, UPI through RuPay Credit Card, 1% Fuel surcharge waiver","NILL","₹5000 worth of Joining Benefits","500 POPcoins on card activation","1500 POPcoins on crossing spends worth 1.5 Lakh","NILL","1% fuel surcharge waiver","NILL","NILL","NILL","NILL","NILL","NILL","NILL","NILL","NILL","NILL","2% cashback on Amazon/Flipkart","NILL","NILL","NILL","Zero liability if reported within 24 hours","NILL","NILL","Yes, accepted worldwide","This card offers rewards on every transaction, including POPcoins, making it ideal for frequent spenders.","Between 21 and 60 years of age, Salaried or self employed, Minimum Net Salary of INR 25,000 per month or Income Tax Return of INR 7.5 lakhs and above","All dues must be paid on time; rewards program subject to change."
"YES BANK","YES BANK Paisabazaar PaisaSave Credit Card","Retail","Cashback","3% Cashback on Online Spends, 1.5% Cashback on Offline Spends, Zero Joining Fee, 1% Waiver on Fuel Surcharge","https://www.yesbank.in/content/published/api/v1.1/assets/CONTFDADB7F1E7374BEA83C8796C8CB29F5A/native/cc-card-paisabazar-paisasave-icon.png?channelToken=21f7ccfa2fc3401091938f541a6f8f2a","https://www.yesbank.in/personal-banking/yes-individual/cards/credit-cards/paisabazaar-credit-card","https://www.paisabazaar.com/cards/marketing/openmarket?partnerProductId=318","Zero Joining Fees","499","waived off on total retail spends of ₹1,20,000 in card anniversary year","NILL","47.88%","NILL","NILL","NILL","NILL","NILL","NILL","NILL","NILL","NILL","NILL","NILL","1% fee + applicable GST","1% fee + applicable GST","1% fee + applicable GST","1% + applicable GST on all utility transactions on Spends above ₹15,000 in a month","Earn 6 Reward Points per ₹200 spent on e-commerce transactions, 3 Reward Points per ₹200 spent on others","3% cashback on online spends, 1.5% cashback on offline spends","Annual fee reversed if spends > ₹1,20,000/year","Yes, on spends above ₹2,500","6 Reward Points per ₹200 spent online, 3 Reward Points per ₹200 spent offline","Free movie tickets, shopping vouchers","Contactless payments, lounge access","NILL","NILL","NILL","NILL","NILL","1% fuel surcharge waiver","NILL","NILL","NILL","NILL","NILL","NILL","NILL","NILL","NILL","NILL","2% cashback on Amazon/Flipkart","8 free domestic lounge visits per year","NILL","NILL","Zero liability if reported within 24 hours","NILL","chip & PIN, contactless, 2FA","Yes, accepted worldwide","This card offers premium travel, shopping, and lifestyle benefits, including lounge access, high rewards, and robust insurance, making it ideal for frequent travelers.","Between 21 to 60 years of age, Salaried or self-employed, Minimum Net Salary of INR 25,000 per month or Income Tax Return of INR 7.5 lakhs and above","All dues must be paid on time; rewards program subject to change."
"YES BANK","YES Prosperity Business Credit Card","Business","Travel, Shopping","Green fee waiver on golf rounds, 1 Domestic lounge access per quarter, 8 reward points on ₹200 spent on selected categories, Attractive Foreign Currency Markup Fee of 2.50%, 1% fuel surcharge waiver","https://www.yesbank.in/content/published/api/v1.1/assets/CONT5F5A5A2D2F534C35B1FB865A29309793/native/yes-prosperity-business-card.png?channelToken=21f7ccfa2fc3401091938f541a6f8f2a","https://www.yesbank.in/business-banking/cards/credit-cards/yes-prosperity-business-card","https://yesorigins.yesbank.in/CCLead/ApplicantDetails?uid=ab287&utm_campaign=banner&utm_content=CCapplynow&utm_medium=featuredcards&utm_source=website","₹499 + GST","₹499 + GST","Waived off on spending ₹1 Lakh in the preceding year","NILL","3.99% per month (47.88% annually)","NILL","NILL","NILL","NILL","NILL","2.5% (subject to a minimum charge of ₹300)","NILL","NILL","2.5%","₹100 + GST","NILL","NILL","NILL","1% fuel surcharge waiver valid for transactions between ₹400 to ₹5000 only. Maximum surcharge waiver in a statement cycle is ₹500.","NILL","Earn 10,000 reward points on annual spends of ₹6 Lakhs or more in each anniversary year","NILL","Spend ₹10,000 within the first 30 days from card activation to get joining fee waived off","Yes, on spends above ₹1,500","8 Reward Points for every ₹200 spent on Air/Hotel/Dining/Travel/Rented Vehicles, 4 Reward Points for every ₹200 on all other eligible spends","10,000 reward points on annual spends of ₹6 Lakhs or more, 1 complimentary Domestic Lounge access per quarter","Complimentary golf lesson every month, fuel surcharge waiver, insurance coverage for air accidents, medical emergencies, and accidental death","NILL","NILL","10,000 reward points on first transaction within 30 days of card issuance","10,000 reward points on annual spends of ₹6 Lakhs or more","NILL","1% fuel surcharge waiver","NILL","NILL","Complimentary lounge access, insurance coverage","NILL","NILL","NILL","NILL","NILL","NILL","NILL","NILL","1 complimentary domestic lounge access per quarter","24x7 concierge assistance","Air Accidental Insurance, Medical Emergency Insurance, Credit Shield","NILL","NILL","Contactless technology, Mastercard SecureCode","Yes, accepted worldwide","The YES Prosperity Business Credit Card provides accelerated rewards on online spends and dining. It also has attractive Foreign Currency Markup along with many other exciting rewards and offers.","Age between 21 and 70 years, self-employed individuals, proprietors, and partners of partnership firms, minimum Income Tax Return of ₹7.5 lakhs","All dues must be paid on time; rewards program subject to change."
"YES BANK","YES FIRST Business Credit Card","Business","Travel, Shopping","Complimentary international lounge access, low foreign currency markup fee, and attractive reward points on business transactions.","https://www.yesbank.in/content/published/api/v1.1/assets/CONTD7490E20419F4E3EA56CDA9C13676DA9/native/yes-first-business-card.png?channelToken=21f7ccfa2fc3401091938f541a6f8f2a","https://www.yesbank.in/business-banking/cards/credit-cards/yes-first-business-card","https://yesorigins.yesbank.in/CCLead/ApplicantDetails?uid=ab287&utm_campaign=banner&utm_content=CCapplynow&utm_medium=featuredcards&utm_source=website","₹999 + GST","₹999 + GST","Joining Fee waived on spending ₹20,000 in first 30 days; Annual Fee waived on spending ₹3 lakh or more in a year.","","3.99% per month (47.88% annually)","","","","","","2.5% (minimum ₹300)","","","1.75%","₹100 + GST","","","","1% fuel surcharge waiver on transactions between ₹400 to ₹5000 (capped at ₹1,000 per month)","","16 Reward Points per ₹200 spent on travel, hotel, dining; 8 Reward Points on other categories; 4 Reward Points on select categories.","","Joining Fee waived on spending ₹20,000 in first 30 days; Annual Fee waived on spending ₹3 lakh or more in a year.","Yes, on transactions above ₹1,500.","20,000 Reward Points on spending ₹12 lakh or more annually.","Complimentary international lounge access, complimentary golf lessons, insurance coverage up to ₹1 crore.","Complimentary Priority Pass Membership, 6 complimentary international lounge visits, 2 domestic lounge visits per quarter, insurance coverage, fuel surcharge waiver.","","20,000 Reward Points on the first transaction within 30 days of card issuance.","20,000 Reward Points on spending ₹12 lakh or more annually.","20,000 Reward Points on spending ₹12 lakh or more annually.","","1% fuel surcharge waiver on transactions between ₹400 to ₹5000 (capped at ₹1,000 per month).","15% off at select restaurants with Dining Fiesta Program.","","Complimentary international lounge access, complimentary golf lessons.","","","","","","","","","6 complimentary international lounge visits, 2 domestic lounge visits per quarter.","24x7 concierge service for travel bookings and other assistance.","Insurance cover up to ₹1 crore for air accidents, ₹25 lakh for medical emergencies abroad, ₹8 lakh for credit shield.","Zero liability for unauthorized transactions if reported within 24 hours.","","Chip & PIN, contactless payments.","Yes, accepted worldwide.","The YES FIRST Business Credit Card offers premium travel, shopping, and lifestyle benefits, including lounge access, high rewards, and robust insurance, making it ideal for frequent travelers and business owners.","Age between 21 and 70 years, self-employed individuals, minimum income tax return of ₹10 lakh.","All dues must be paid on time; rewards program subject to change."
